{
  "profile_version": "aau-public-value-ledger/0.5",
  "ledger_id": "synthetic-civilian-public-value",
  "sharing": {
    "classification": "public_synthetic",
    "human_review_complete": true,
    "contains_personally_identifiable_information": false,
    "contains_procurement_sensitive_information": false,
    "contains_controlled_unclassified_information": false,
    "contains_classified_information": false,
    "contains_secrets_or_credentials": false
  },
  "records": [
    {
      "record_id": "notice-review-pilot",
      "use_case_id": "benefit-notice-plain-language",
      "status": "measured",
      "baseline": {
        "cases": 120,
        "minutes_per_case": 18.0,
        "error_rate": 0.14,
        "human_review_minutes_per_case": 18.0
      },
      "observed": {
        "cases": 120,
        "minutes_per_case": 13.5,
        "error_rate": 0.1,
        "human_review_minutes_per_case": 13.5
      },
      "costs": {
        "pilot_cost_usd": 24000,
        "annual_operating_cost_usd": 175000
      },
      "measurement": {
        "method": "Paired synthetic notice review with blinded human adjudication and branch-specific accessibility scoring.",
        "limitations": "One synthetic notice family, no production applicants, no causal estimate, and no audited financial savings."
      },
      "claims_verified_savings": false
    },
    {
      "record_id": "service-chatbot-baseline",
      "use_case_id": "service-chatbot",
      "status": "baseline_only",
      "baseline": {
        "cases": 240,
        "minutes_per_case": 9.2,
        "error_rate": 0.08,
        "human_review_minutes_per_case": 4.1
      },
      "observed": {
        "cases": null,
        "minutes_per_case": null,
        "error_rate": null,
        "human_review_minutes_per_case": null
      },
      "costs": {
        "pilot_cost_usd": 31000,
        "annual_operating_cost_usd": 250000
      },
      "measurement": {
        "method": "Synthetic pre-pilot service-navigation baseline with current official-source verification.",
        "limitations": "Observed pilot measurements are not yet available; no benefit or savings conclusion is supported."
      },
      "claims_verified_savings": false
    }
  ]
}
